<?xml version="1.0" encoding="UTF-8"?>
<!DOCTYPE functionset PUBLIC "//MMBase - functionset //" "http://www.mmbase.org/dtd/functionset_1_0.dtd">
<functionset>
<version>1</version>
<description>Functionset to create a PDF from a webpage.</description>
  
  <function name="xml2pdf">
    <description>Creates an attachments node containing a PDF from a xml.</description>
    <type>class</type>
    <class>org.mmbase.applications.xml2pdf.XML2PDFnode</class>
    <method>createPDFnode</method>
    <param name="cloud" type="org.mmbase.bridge.Cloud" description="MMBase cloud" />
	<param name="xml"   type="String" description="The xml or xhtml use, has to be a complete url" />
	<param name="xsl"   type="String" description="A xhtml2pdf XSL (FO) file to transform the xhtml to fo which FOP can use (has to live in MMBase its config/xsl directory)." />
    <param name="title" type="String" description="Title of the resulting attachments node" />
    <return type="Node" />
  </function>
  
</functionset>
